{
  "bundleVersion": "1.0.0",
  "generatedAt": "2023-10-01T12:00:00Z",
  "source": "Curriculum Development Team",
  "lessons": [
    {
      "slug": "biology-gcse-aqa-photosynthesis",
      "title": "Photosynthesis",
      "subjectId": "biology",
      "levelId": "gcse",
      "boardId": "aqa",
      "topicId": "photosynthesis",
      "learningObjectives": [
        "Define photosynthesis",
        "Interpret rate graphs",
        "Understand the word equation",
        "Identify limiting factors",
        "Conduct required practicals"
      ],
      "keywords": [
        "photosynthesis",
        "biology",
        "gcse",
        "aqa",
        "limiting factors",
        "practicals",
        "word equation"
      ],
      "pages": [
        {
          "title": "Introduction to Photosynthesis",
          "blocks": [
            {
              "type": "explanation",
              "content": "Photosynthesis is the process by which green plants and some other organisms use sunlight to synthesize foods with the help of chlorophyll."
            },
            {
              "type": "summary",
              "content": "In summary, photosynthesis converts light energy into chemical energy."
            }
          ]
        },
        {
          "title": "Word Equation of Photosynthesis",
          "blocks": [
            {
              "type": "explanation",
              "content": "The word equation for photosynthesis is: Carbon Dioxide + Water → Glucose + Oxygen."
            },
            {
              "type": "quizCheckpoint",
              "mcqs": [
                {
                  "question": "What is the word equation for photosynthesis?",
                  "choices": [
                    "Carbon Dioxide + Water → Glucose + Oxygen",
                    "Glucose + Oxygen → Carbon Dioxide + Water",
                    "Oxygen + Water → Carbon Dioxide + Glucose",
                    "Carbon Dioxide + Glucose → Water + Oxygen"
                  ],
                  "correctIndex": 0,
                  "rationale": "The correct word equation represents the process of photosynthesis."
                }
              ]
            }
          ]
        },
        {
          "title": "Limiting Factors in Photosynthesis",
          "blocks": [
            {
              "type": "explanation",
              "content": "Limiting factors are conditions that can restrict the rate of photosynthesis."
            },
            {
              "type": "workedExample",
              "content": "For example, if light intensity is low, the rate of photosynthesis will decrease."
            }
          ]
        },
        {
          "title": "Required Practicals",
          "blocks": [
            {
              "type": "explanation",
              "content": "Students will conduct experiments to measure the rate of photosynthesis."
            },
            {
              "type": "quizCheckpoint",
              "mcqs": [
                {
                  "question": "What is a required practical in photosynthesis?",
                  "choices": [
                    "Measuring the rate of photosynthesis using aquatic plants",
                    "Calculating the amount of glucose produced",
                    "Observing plant growth in different light conditions",
                    "Testing soil pH levels"
                  ],
                  "correctIndex": 0,
                  "rationale": "Measuring the rate of photosynthesis using aquatic plants is a common practical."
                }
              ]
            }
          ]
        }
      ],
      "isPublished": false,
      "isFreePreview": false,
      "status": "draft"
    }
  ]
}