{
  "bundleVersion": "1.0.0",
  "generatedAt": "2026-02-04T00:00:00Z",
  "source": "manual-dry-run",
  "lessons": [
    {
      "slug": "biology-gcse-aqa-photosynthesis",
      "title": "Photosynthesis (AQA GCSE Biology)",
      "subjectId": "biology",
      "levelId": "gcse",
      "boardId": "aqa",
      "topicId": "photosynthesis",
      "isPublished": false,
      "isFreePreview": false,
      "learningObjectives": [
        "Define photosynthesis",
        "Recall the word equation for photosynthesis",
        "Explain limiting factors"
      ],
      "keywords": [
        "photosynthesis",
        "chlorophyll",
        "glucose",
        "oxygen",
        "carbon-dioxide",
        "light-intensity"
      ],
      "examTips": [
        "Remember photosynthesis is endothermic"
      ],
      "commonMistakes": [
        "Confusing respiration with photosynthesis"
      ],
      "pages": [
        {
          "title": "What is Photosynthesis?",
          "blocks": [
            {
              "type": "explanation",
              "content": "Photosynthesis is the process by which plants make glucose using light energy."
            },
            {
              "type": "quizCheckpoint",
              "mcqs": [
                {
                  "question": "Which gas is required for photosynthesis?",
                  "choices": [
                    "Oxygen",
                    "Nitrogen",
                    "Carbon dioxide",
                    "Hydrogen"
                  ],
                  "correctIndex": 2,
                  "rationale": "Carbon dioxide is a reactant in photosynthesis.",
                  "misconceptionDistractors": [
                    "Oxygen is produced, not used"
                  ]
                }
              ]
            }
          ]
        },
        {
          "title": "Limiting Factors",
          "blocks": [
            {
              "type": "workedExample",
              "content": "As light intensity increases, the rate of photosynthesis increases until another factor becomes limiting."
            },
            {
              "type": "summary",
              "content": "Light intensity, temperature, and carbon dioxide concentration can limit photosynthesis."
            }
          ]
        },
        {
          "title": "Exam Focus",
          "blocks": [
            {
              "type": "examStylePrompt",
              "content": "Explain how light intensity affects the rate of photosynthesis."
            },
            {
              "type": "quizCheckpoint",
              "mcqs": [
                {
                  "question": "Which factor does NOT affect photosynthesis?",
                  "choices": [
                    "Light intensity",
                    "Temperature",
                    "Carbon dioxide concentration",
                    "Sound"
                  ],
                  "correctIndex": 3,
                  "rationale": "Sound has no effect on photosynthesis."
                }
              ]
            }
          ]
        }
      ]
    }
  ]
}

